{
  "schemaVersion": "2.0.0",
  "language": {
    "source": "en",
    "translation": "zh-Hans"
  },
  "sourceTitle": "Official Exam Practice from Trivie Learn results",
  "generatedAt": "2026-10-23T19:06:51.866Z",
  "statistics": {
    "total": 100,
    "approved": 100,
    "bankCount": 5,
    "bankSize": 20
  },
  "questions": [
    {
      "id": "official-practice-001",
      "section": "practice",
      "chapter": 0,
      "chapterTitle": {
        "en": "Official Exam Practice",
        "zh": "官方考试练习"
      },
      "collection": "official-practice-pool",
      "type": "multiple-choice",
      "question": {
        "en": "An example of a disease caused by a plant parasite is",
        "zh": "由植物寄生虫引起的疾病示例是"
      },
      "choices": [
        {
          "id": "a",
          "en": "diphtheria.",
          "zh": "白喉"
        },
        {
          "id": "b",
          "en": "hepatitis.",
          "zh": "肝炎"
        },
        {
          "id": "c",
          "en": "ringworm.",
          "zh": "癣"
        },
        {
          "id": "d",
          "en": "scabies.",
          "zh": "疥疮"
        }
      ],
      "correctChoice": "c",
      "sources": [
        {
          "book": "NIC Nail Technology Practice Exam - Trivie Learn",
          "itemRef": "q01"
        }
      ],
      "choicesOrigin": "source",
      "status": "approved",
      "explanation": {
        "en": "Ringworm is a contagious fungal skin infection. On hands or feet, it may form itchy rings, peeling skin, or small blisters.",
        "zh": "ringworm（癣）是一种会传染的真菌性皮肤感染。发生在手足时，可能出现瘙痒的环形斑、脱皮或小水疱。"
      },
      "lockPoint": {
        "en": "ringworm = fungal infection; scabies = animal parasite.",
        "zh": "ringworm = 真菌感染；scabies（疥疮）= 动物寄生虫感染。"
      },
      "teachingRelation": "contrast",
      "authorityRefs": [
        {
          "source": "Milady Standard Nail Technology 8th Edition",
          "section": "Skin Structure, Disorders, and Diseases - Infectious Skin Disorders",
          "printedPage": "86",
          "pdfPage": 110
        }
      ],
      "teachingAuthor": "codex-authoring-run-2026-08-26-phase-3",
      "authoredAt": "2026-08-26"
    },
    {
      "id": "official-practice-002",
      "section": "practice",
      "chapter": 0,
      "chapterTitle": {
        "en": "Official Exam Practice",
        "zh": "官方考试练习"
      },
      "collection": "official-practice-pool",
      "type": "multiple-choice",
      "question": {
        "en": "Monomer liquids, UV gels, and adhesives will form",
        "zh": "单体液、UV凝胶和粘合剂会产生"
      },
      "choices": [
        {
          "id": "a",
          "en": "fumes.",
          "zh": "烟雾"
        },
        {
          "id": "b",
          "en": "gases.",
          "zh": "气体"
        },
        {
          "id": "c",
          "en": "dust.",
          "zh": "粉尘"
        },
        {
          "id": "d",
          "en": "vapors.",
          "zh": "蒸气"
        }
      ],
      "correctChoice": "d",
      "sources": [
        {
          "book": "NIC Nail Technology Practice Exam - Trivie Learn",
          "itemRef": "q02"
        }
      ],
      "choicesOrigin": "source",
      "status": "approved",
      "explanation": {
        "en": "Liquids form vapors when they evaporate into air. Monomer liquid, gel ingredients, and adhesives release vapors rather than smoke-like fumes.",
        "zh": "液体蒸发到空气中会形成 vapor（蒸气）。单体液、凝胶成分和粘合剂释放的是蒸气，不是含烟尘的 fumes（烟雾）。"
      },
      "lockPoint": {
        "en": "liquid evaporates = vapor; burning material = fumes.",
        "zh": "液体蒸发 = vapor；物质燃烧 = fumes。"
      },
      "teachingRelation": "contrast",
      "authorityRefs": [
        {
          "source": "Milady Standard Nail Technology 8th Edition",
          "section": "Nail Product Chemistry - Gases, Vapors, and Fumes",
          "printedPage": "116",
          "pdfPage": 140
        }
      ],
      "teachingAuthor": "codex-authoring-run-2026-08-26-phase-3",
      "authoredAt": "2026-08-26"
    },
    {
      "id": "official-practice-003",
      "section": "practice",
      "chapter": 0,
      "chapterTitle": {
        "en": "Official Exam Practice",
        "zh": "官方考试练习"
      },
      "collection": "official-practice-pool",
      "type": "multiple-choice",
      "question": {
        "en": "Which of the following is a secondary skin lesion?",
        "zh": "以下哪项是继发性皮损？"
      },
      "choices": [
        {
          "id": "a",
          "en": "Tumor",
          "zh": "肿瘤"
        },
        {
          "id": "b",
          "en": "Fissure",
          "zh": "皲裂"
        },
        {
          "id": "c",
          "en": "Papule",
          "zh": "丘疹"
        },
        {
          "id": "d",
          "en": "Bulla",
          "zh": "大疱"
        }
      ],
      "correctChoice": "b",
      "sources": [
        {
          "book": "NIC Nail Technology Practice Exam - Trivie Learn",
          "itemRef": "q03"
        }
      ],
      "choicesOrigin": "source",
      "status": "approved",
      "explanation": {
        "en": "A fissure is a crack that reaches into living skin. Secondary lesions develop after skin damage or a change in a primary lesion.",
        "zh": "fissure（皲裂）是深入活体皮肤的裂口。继发性皮损会在皮肤受损后，或原发性皮损发生变化后形成。"
      },
      "lockPoint": {
        "en": "fissure = secondary crack in the skin.",
        "zh": "fissure = 皮肤上的继发性裂口。"
      },
      "teachingRelation": "recognition",
      "authorityRefs": [
        {
          "source": "Milady Standard Nail Technology 8th Edition",
          "section": "Skin Structure, Disorders, and Diseases - Secondary Skin Lesions",
          "printedPage": "80",
          "pdfPage": 104
        }
      ],
      "teachingAuthor": "codex-authoring-run-2026-08-26-phase-3",
      "authoredAt": "2026-08-26"
    },
    {
      "id": "official-practice-004",
      "section": "practice",
      "chapter": 0,
      "chapterTitle": {
        "en": "Official Exam Practice",
        "zh": "官方考试练习"
      },
      "collection": "official-practice-pool",
      "type": "multiple-choice",
      "question": {
        "en": "Which of the following is a characteristic of nail polishes, top coats, and base coats?",
        "zh": "以下哪项是指甲油、亮油和底油的特性？"
      },
      "choices": [
        {
          "id": "a",
          "en": "They adhere best when the nail is etched.",
          "zh": "指甲经过打磨处理后，它们的附着效果最好"
        },
        {
          "id": "b",
          "en": "They work by evaporation.",
          "zh": "它们通过蒸发起作用"
        },
        {
          "id": "c",
          "en": "They polymerize.",
          "zh": "它们会发生聚合反应"
        },
        {
          "id": "d",
          "en": "They require a catalyst.",
          "zh": "它们需要催化剂"
        }
      ],
      "correctChoice": "b",
      "sources": [
        {
          "book": "NIC Nail Technology Practice Exam - Trivie Learn",
          "itemRef": "q04"
        }
      ],
      "choicesOrigin": "source",
      "status": "approved",
      "explanation": {
        "en": "Traditional nail polish hardens as solvents evaporate and leave a coating behind. It does not need the polymerization used by enhancement products.",
        "zh": "传统指甲油中的溶剂蒸发后，会留下并形成涂层。它不需要像美甲增强材料那样发生聚合反应。"
      },
      "lockPoint": {
        "en": "nail polish = solvent evaporation; enhancements may polymerize.",
        "zh": "指甲油 = 溶剂蒸发；美甲增强材料可能发生聚合。"
      },
      "teachingRelation": "process",
      "authorityRefs": [
        {
          "source": "Milady Standard Nail Technology 8th Edition",
          "section": "Nail Product Chemistry - Nail Coating Products",
          "printedPage": "121",
          "pdfPage": 145
        }
      ],
      "teachingAuthor": "codex-authoring-run-2026-08-26-phase-3",
      "authoredAt": "2026-08-26"
    },
    {
      "id": "official-practice-005",
      "section": "practice",
      "chapter": 0,
      "chapterTitle": {
        "en": "Official Exam Practice",
        "zh": "官方考试练习"
      },
      "collection": "official-practice-pool",
      "type": "multiple-choice",
      "question": {
        "en": "An example of a tubercle is",
        "zh": "结节的示例是"
      },
      "choices": [
        {
          "id": "a",
          "en": "acne.",
          "zh": "痤疮"
        },
        {
          "id": "b",
          "en": "freckles.",
          "zh": "雀斑"
        },
        {
          "id": "c",
          "en": "a cyst.",
          "zh": "囊肿"
        },
        {
          "id": "d",
          "en": "a wart.",
          "zh": "疣"
        }
      ],
      "correctChoice": "c",
      "sources": [
        {
          "book": "NIC Nail Technology Practice Exam - Trivie Learn",
          "itemRef": "q05"
        }
      ],
      "choicesOrigin": "source",
      "status": "approved",
      "explanation": {
        "en": "Cysts and tubercles are raised primary lesions that may occur above or below the skin. Both require medical referral, not salon treatment.",
        "zh": "cyst（囊肿）和 tubercle（结节）都是可位于皮肤表面或下方的隆起性原发皮损，都应转介医疗人员，不能在沙龙处理。"
      },
      "lockPoint": {
        "en": "raised primary lesion = recognize and refer.",
        "zh": "隆起性原发皮损 = 识别后转介。"
      },
      "teachingRelation": "safety-reason",
      "authorityRefs": [
        {
          "source": "Milady Standard Nail Technology 8th Edition",
          "section": "Skin Structure, Disorders, and Diseases - Primary Skin Lesions",
          "printedPage": "78",
          "pdfPage": 102
        }
      ],
      "teachingAuthor": "codex-authoring-run-2026-08-26-phase-3",
      "authoredAt": "2026-08-26"
    },
    {
      "id": "official-practice-006",
      "section": "practice",
      "chapter": 0,
      "chapterTitle": {
        "en": "Official Exam Practice",
        "zh": "官方考试练习"
      },
      "collection": "official-practice-pool",
      "type": "multiple-choice",
      "question": {
        "en": "A characteristic of natural nails is that",
        "zh": "天然指甲的一个特性是"
      },
      "choices": [
        {
          "id": "a",